{"$schema":"https://json-schema.org/draft/2020-12/schema","type":"object","required":["schemaVersion","timingSources","warmup","measuredRuns","durationSeconds","scenarios"],"properties":{"schemaVersion":{"const":1},"timingSources":{"type":"array","minItems":4,"uniqueItems":true,"items":{"enum":["engineCpu","rendererCpu","animationCpu","gpuTimestamp"]}},"warmup":{"type":"object","required":["minimumSeconds","minimumFrames"],"properties":{"minimumSeconds":{"type":"integer","minimum":30},"minimumFrames":{"type":"integer","minimum":120}}},"measuredRuns":{"const":5},"durationSeconds":{"const":60},"scenarios":{"type":"array","minItems":6,"maxItems":6,"items":{"type":"object","required":["id","population","routeMix","animationPolicy","specialistMask","seed"],"properties":{"id":{"type":"string","minLength":1},"population":{"type":"integer","minimum":1},"routeMix":{"type":"object","required":["direct","denseVirtualGeometry"],"properties":{"direct":{"type":"integer","minimum":0},"denseVirtualGeometry":{"type":"integer","minimum":0}}},"animationPolicy":{"type":"string","minLength":1},"specialistMask":{"type":"string","minLength":1},"seed":{"type":"integer"}}}}}}
